指標名,保育園,,,認可保育所,https://www.fukushihoken.metro.tokyo.lg.jp/kiban/fukushi_shisetsu/shs_list/index.html,,,,
品川区,大崎五丁目,-,品川区大崎５−４−３　小野ビル１階,35.623111,139.725328,にじいろ保育園大崎,認可,60,2022年10月1日時点
品川区,西品川一丁目,-,品川区西品川１−２８−１４,35.609009,139.726625,そらのいろ保育園,認可,73,2022年10月1日時点
品川区,西品川二丁目,-,品川区西品川２−２２−２,35.612777,139.725378,キッズガーデン西品川,認可,60,2022年10月1日時点
品川区,西品川二丁目,-,品川区西品川３−１６−３５,35.614523,139.728161,西品川保育園,認可,147,2022年10月1日時点
品川区,西品川二丁目,-,品川区西品川３−１６−３５,35.614523,139.728161,西品川保育園,認可,147,2022年10月1日時点
品川区,戸越四丁目,-,品川区戸越４−１−１０,35.612722,139.717945,東戸越保育園,認可,70,2022年10月1日時点
品川区,戸越五丁目,-,品川区戸越５−１４−２３,35.610557,139.715199,グローバルキッズ戸越園,認可,60,2022年10月1日時点
品川区,戸越四丁目,-,品川区戸越六丁目１５番５号,35.612722,139.717945,キッズラボ中延園,認可,73,2022年10月1日時点
品川区,豊町一丁目,-,品川区豊町１−１８−１５,35.611535,139.722749,ゆたか保育園,認可,70,2022年10月1日時点
品川区,豊町一丁目,-,品川区豊町１−１８−１５,35.611535,139.722749,ゆたか保育園,認可,70,2022年10月1日時点
品川区,豊町二丁目,-,品川区豊町２−１−３０,35.610639,139.722938,三ツ木保育園,認可,80,2022年10月1日時点
品川区,豊町二丁目,-,品川区豊町２−１−３０,35.610639,139.722938,三ツ木保育園,認可,80,2022年10月1日時点
品川区,豊町二丁目,-,品川区豊町２−１６−１２,35.60943,139.725348,日本音楽学校保育園,認可,26,2022年10月1日時点
品川区,豊町三丁目,-,品川区豊町３−５−３１,35.609007,139.720938,ほうさん保育園,認可,25,2022年10月1日時点
品川区,豊町三丁目,-,品川区豊町３−５−３１,35.609007,139.720938,ほうさん保育園,認可,75,2022年10月1日時点
品川区,豊町四丁目,-,品川区豊町４−１７−２１,35.6065,139.720921,南ゆたか保育園,認可,107,2022年10月1日時点
品川区,豊町四丁目,-,品川区豊町４−１７−２１,35.6065,139.720921,南ゆたか保育園,認可,107,2022年10月1日時点
品川区,豊町五丁目,-,品川区豊町５−１３−１５,35.605169,139.72007,キッズガーデン品川豊町,認可,83,2022年10月1日時点
品川区,豊町三丁目,-,品川区豊町三丁目２番１３号,35.608136,139.719369,さんさん森の保育園戸越公園,認可,84,2022年10月1日時点
品川区,二葉一丁目,-,品川区二葉１−１２−１８,35.606797,139.726801,ポピンズナーサリースクール大井町,認可,60,2022年10月1日時点
品川区,二葉一丁目,-,品川区二葉１−３−４０,35.607037,139.72556,二葉つぼみ保育園,認可,66,2022年10月1日時点
品川区,二葉一丁目,-,品川区二葉１−３−４０,35.607037,139.72556,二葉つぼみ保育園,認可,66,2022年10月1日時点
品川区,二葉一丁目,-,品川区二葉１−４−２５,35.607987,139.726673,二葉保育園,認可,63,2022年10月1日時点
品川区,二葉一丁目,-,品川区二葉１−４−２５,35.607987,139.726673,二葉保育園,認可,63,2022年10月1日時点
品川区,二葉四丁目,-,品川区二葉４−２−１３,35.602651,139.713816,こころしながわなかのぶ保育園,認可,94,2022年10月1日時点
品川区,二葉四丁目,-,品川区二葉四丁目３番８号,35.602916,139.714723,はぐはぐキッズ二葉,認可,60,2022年10月1日時点
品川区,平塚二丁目,-,品川区平塚２−１８−１９,35.615453,139.71333,とごしの杜保育園,認可,108,2022年10月1日時点
品川区,平塚二丁目,-,品川区平塚２−２−３,35.618787,139.717415,平塚保育園,認可,107,2022年10月1日時点
品川区,平塚二丁目,-,品川区平塚２−２−３,35.618787,139.717415,平塚保育園,認可,107,2022年10月1日時点
品川区,平塚二丁目,-,品川区平塚二丁目１４番１号,35.616652,139.713297,チャイルドマインダー平塚荏原,認可,80,2022年10月1日時点
品川区,東中延二丁目,-,品川区東中延１−６−２,35.609207,139.713477,モニカ荏原中延園,認可,60,2022年10月1日時点
品川区,東中延二丁目,-,品川区東中延２−５−１０,35.609207,139.713477,東中延保育園,認可,96,2022年10月1日時点
品川区,東中延二丁目,-,品川区東中延２−５−１０,35.609207,139.713477,東中延保育園,認可,96,2022年10月1日時点
品川区,中延四丁目,-,品川区中延２−６−４,35.605055,139.710285,こころしながわえばら保育園,認可,107,2022年10月1日時点
品川区,中延四丁目,-,品川区中延４−１４−１９,35.605055,139.710285,源氏前保育園,認可,113,2022年10月1日時点
品川区,中延四丁目,-,品川区中延４−１４−１９,35.605055,139.710285,源氏前保育園,認可,113,2022年10月1日時点
品川区,中延四丁目,-,品川区中延４−５−７,35.605055,139.710285,グローバルキッズ中延園,認可,60,2022年10月1日時点
品川区,中延四丁目,-,品川区中延５−２−１,35.605055,139.710285,グローバルキッズ荏原町保育園,認可,90,2022年10月1日時点
品川区,中延四丁目,-,品川区中延６−１−１９,35.605055,139.710285,このえ中延保育園,認可,70,2022年10月1日時点
品川区,西中延二丁目,-,品川区西中延１−６−１６,35.608623,139.707731,中延保育園,認可,126,2022年10月1日時点
品川区,西中延二丁目,-,品川区西中延１−６−１６,35.608623,139.707731,中延保育園,認可,126,2022年10月1日時点
品川区,西中延二丁目,-,品川区西中延３−８−５,35.608623,139.707731,西中延保育園,認可,83,2022年10月1日時点
品川区,西中延二丁目,-,品川区西中延３−８−５,35.608623,139.707731,西中延保育園,認可,83,2022年10月1日時点
品川区,小山台一丁目,-,品川区小山台１−２５−１０,35.621935,139.706732,チャイルドマインダー小山台東,認可,73,2022年10月1日時点
品川区,小山台一丁目,-,品川区小山台１−３−８,35.625048,139.706818,小山台保育園,認可,93,2022年10月1日時点
品川区,小山台一丁目,-,品川区小山台１−３−８,35.625048,139.706818,小山台保育園,認可,93,2022年10月1日時点
品川区,小山一丁目,-,品川区小山１−４−１,35.622123,139.712573,中原保育園,認可,96,2022年10月1日時点
品川区,小山一丁目,-,品川区小山１−４−１,35.622123,139.712573,中原保育園,認可,96,2022年10月1日時点
品川区,小山三丁目,-,品川区小山３−７−１６,35.620503,139.706714,こどもヶ丘保育園小山園,認可,60,2022年10月1日時点
品川区,小山四丁目,-,品川区小山４−１４−１０,35.617487,139.703044,ウィズブック保育園武蔵小山パルズ,認可,117,2022年10月1日時点
品川区,小山四丁目,-,品川区小山４−３−９,35.618959,139.702934,品川大和保育園,認可,60,2022年10月1日時点
品川区,小山四丁目,-,品川区小山４−４−７　コスモ武蔵小山ビル１・２階,35.618547,139.704309,ウィズブック保育園武蔵小山,認可,60,2022年10月1日時点
品川区,小山五丁目,-,品川区小山５−９−１６,35.616666,139.702845,こころしながわむさしこやま保育園,認可,101,2022年10月1日時点
品川区,小山七丁目,-,品川区小山７−１１−６,35.610097,139.697941,キッズガーデン品川洗足,認可,73,2022年10月1日時点
品川区,小山三丁目,-,品川区小山三丁目１５番１号　パークシティ武蔵小山　ザ　モール,35.620007,139.704194,ニチイキッズむさしこやま保育園,認可,30,2022年10月1日時点
品川区,荏原二丁目,-,品川区荏原２−１６−１８,35.616654,139.709006,荏原保育園,認可,120,2022年10月1日時点
品川区,荏原二丁目,-,品川区荏原２−１６−１８,35.616654,139.709006,荏原保育園,認可,120,2022年10月1日時点
品川区,荏原三丁目,-,品川区荏原３−１−１８,35.618135,139.707624,さくらさくみらい武蔵小山,認可,70,2022年10月1日時点
品川区,荏原四丁目,-,品川区荏原４−１６−１１,35.613887,139.706183,荏原西保育園,認可,100,2022年10月1日時点
品川区,荏原四丁目,-,品川区荏原４−１６−１１,35.613887,139.706183,荏原西保育園,認可,100,2022年10月1日時点
品川区,荏原四丁目,-,品川区荏原４−５−２２,35.61507,139.707675,荏原西第二保育園,認可,88,2022年10月1日時点
品川区,荏原四丁目,-,品川区荏原４−５−２２,35.61507,139.707675,荏原西第二保育園,認可,88,2022年10月1日時点
品川区,荏原六丁目,-,品川区荏原６−１２−１５,35.612334,139.705757,ウィズブック保育園荏原,認可,89,2022年10月1日時点
品川区,荏原七丁目,-,品川区荏原７−８−３,35.611653,139.701542,清水台保育園,認可,100,2022年10月1日時点
品川区,荏原七丁目,-,品川区荏原７−８−３,35.611653,139.701542,清水台保育園,認可,100,2022年10月1日時点
品川区,旗の台三丁目,-,品川区旗の台３−２−９,35.605062,139.706814,みらいく旗の台園,認可,60,2022年10月1日時点
品川区,旗の台三丁目,-,品川区旗の台３−３−２０,35.605571,139.707224,Ｇａｋｋｅｎほいくえん　旗の台,認可,60,2022年10月1日時点
品川区,旗の台六丁目,-,品川区旗の台六丁目２９番１４号,35.604793,139.698213,アソシエ旗の台保育園,認可,69,2022年10月1日時点
渋谷区,神宮前三丁目,-,渋谷区神宮前３−１８−８,35.671213,139.709966,渋谷保育園,認可,135,2022年10月1日時点
渋谷区,神宮前六丁目,-,渋谷区神宮前６−１０−１４,35.667528,139.7052,神宮前保育園にじ,認可,45,2022年10月1日時点
渋谷区,神宮前六丁目,-,渋谷区神宮前６−３４−２５,35.667567,139.70243,未来のカプセル原宿保育園,認可,39,2022年10月1日時点
渋谷区,渋谷一丁目,-,渋谷区渋谷１−１８−９,35.661791,139.704697,ベネッセ美竹の丘保育園,認可,64,2022年10月1日時点
渋谷区,東二丁目,-,渋谷区東２−２０−１８,35.65365,139.70911,氷川保育園,認可,64,2022年10月1日時点
渋谷区,東四丁目,-,渋谷区東４−７−８,35.655814,139.713098,渋谷東ちとせ保育園,認可,90,2022年10月1日時点
渋谷区,広尾一丁目,-,渋谷区広尾１−３−１１,35.648763,139.712998,遍照広尾保育園,認可,108,2022年10月1日時点
渋谷区,広尾四丁目,-,渋谷区広尾４−１−１,35.652864,139.719141,広尾上宮保育園,認可,100,2022年10月1日時点
渋谷区,広尾五丁目,-,渋谷区広尾５−７−１,35.649261,139.722328,広尾保育園,認可,105,2022年10月1日時点
渋谷区,恵比寿一丁目,-,渋谷区恵比寿１−２７−１０,35.647518,139.71641,新橋保育園,認可,112,2022年10月1日時点
渋谷区,恵比寿西二丁目,-,渋谷区恵比寿西２−１３−５,35.651108,139.705976,ChaCha Children Daikanyama,認可,113,2022年10月1日時点
渋谷区,恵比寿西二丁目,-,渋谷区恵比寿西２−８−１,35.649914,139.707232,恵比寿保育園,認可,108,2022年10月1日時点
渋谷区,恵比寿南三丁目,-,渋谷区恵比寿南３−１１−２５,35.644686,139.706774,ポピンズナーサリースクール恵比寿南,認可,130,2022年10月1日時点
渋谷区,桜丘町,-,渋谷区桜丘町２３−２１,35.655458,139.699965,さくら上宮保育園,認可,70,2022年10月1日時点
渋谷区,鴬谷町,-,渋谷区鴬谷町２−１６,35.654035,139.704476,ほっぺるランド渋谷,認可,90,2022年10月1日時点
渋谷区,代官山町,-,渋谷区代官山町７−９,35.650728,139.705022,代官山保育園,認可,83,2022年10月1日時点
渋谷区,宇田川町,-,渋谷区宇田川町３８−４,35.662066,139.696003,渋谷もりのこ保育園神南,認可,103,2022年10月1日時点
渋谷区,松涛一丁目,-,渋谷区松濤１−２６−６,35.658986,139.693073,大向保育園,認可,96,2022年10月1日時点
渋谷区,千駄ケ谷三丁目,-,渋谷区千駄ヶ谷３−２１−５,35.677086,139.70883,美希保育園北参道,認可,83,2022年10月1日時点
渋谷区,千駄ケ谷三丁目,-,渋谷区千駄ヶ谷３−３４−９,35.677563,139.706976,千駄ケ谷保育園,認可,76,2022年10月1日時点
渋谷区,千駄ケ谷四丁目,-,渋谷区千駄ヶ谷４−２８−８,35.680914,139.70342,鳩の森保育園,認可,67,2022年10月1日時点
渋谷区,千駄ケ谷五丁目,-,渋谷区千駄ヶ谷５−２７−５　リンクスクエア新宿２Ｆ,35.686527,139.702838,千駄ヶ谷りとるぱんぷきんず,認可,63,2022年10月1日時点
渋谷区,千駄ケ谷五丁目,-,渋谷区千駄ヶ谷五丁目２４番５５号,35.688402,139.700698,キッズハーモニー・ＮＥＷｏＭａｎ,認可,39,2022年10月1日時点
渋谷区,代々木三丁目,-,渋谷区代々木３−５１−８,35.681984,139.695977,代々木保育園,認可,95,2022年10月1日時点
渋谷区,代々木四丁目,-,渋谷区代々木４−２７−６,35.682831,139.691318,太陽の子代々木西参道保育園,認可,131,2022年10月1日時点
渋谷区,代々木四丁目,-,渋谷区代々木４−３７−１５,35.68083,139.689243,みんなのみらいをつくる保育園初台,認可,30,2022年10月1日時点
渋谷区,代々木四丁目,-,渋谷区代々木４−５０−１３,35.678465,139.691506,参宮橋ちとせ保育園,認可,180,2022年10月1日時点
渋谷区,代々木五丁目,-,渋谷区代々木５−１６−４,35.674721,139.688698,聖ヨゼフ保育園,認可,114,2022年10月1日時点
渋谷区,代々木五丁目,-,渋谷区代々木５−７−２,35.669846,139.688625,グローバルキッズ代々木八幡園,認可,79,2022年10月1日時点
渋谷区,代々木二丁目,-,渋谷区代々木二丁目３５番１号,35.684525,139.697932,キッズハーモニー・よよぎの杜,認可,199,2022年10月1日時点
渋谷区,初台二丁目,-,渋谷区初台２−１３−１１,35.676497,139.683384,ゆめの樹保育園はつだい,認可,71,2022年10月1日時点
渋谷区,初台二丁目,-,渋谷区初台２−１７−２２,35.677547,139.684688,初台保育園,認可,117,2022年10月1日時点
渋谷区,初台二丁目,-,渋谷区初台２−１９−１６,35.677813,139.686481,さくらさくみらい　初台,認可,71,2022年10月1日時点
渋谷区,元代々木町,-,渋谷区元代々木町５１−１９,35.67331,139.686688,元代々木保育園,認可,87,2022年10月1日時点
渋谷区,富ケ谷一丁目,-,渋谷区富ヶ谷１−３１−３,35.666067,139.688366,富ヶ谷ちとせ保育園,認可,79,2022年10月1日時点
渋谷区,富ケ谷二丁目,-,渋谷区富ヶ谷２−３０−８,35.665209,139.685072,富ヶ谷保育園,認可,94,2022年10月1日時点
渋谷区,上原二丁目,-,渋谷区上原２−４２−３,35.666445,139.681546,ポピンズナーサリースクール代々木上原,認可,90,2022年10月1日時点
渋谷区,上原三丁目,-,渋谷区上原３−３７−９,35.666193,139.676283,さくらさくみらい上原,認可,77,2022年10月1日時点
渋谷区,西原一丁目,-,渋谷区西原１−４０−３,35.67465,139.682489,西原ほほえみ保育園,認可,63,2022年10月1日時点
渋谷区,西原一丁目,-,渋谷区西原１−４７−２,35.673855,139.684731,聖ヨゼフ保育園西原,認可,59,2022年10月1日時点
渋谷区,西原二丁目,-,渋谷区西原２−３３−１７,35.674632,139.676432,さくらさくみらい西原,認可,70,2022年10月1日時点
渋谷区,西原三丁目,-,渋谷区西原３−１５−１０,35.670045,139.679712,グローバルキッズ代々木上原園,認可,79,2022年10月1日時点
渋谷区,西原一丁目,-,渋谷区西原一丁目２２番２０号,35.676251,139.678476,西原保育園ゆめ,認可,106,2022年10月1日時点
渋谷区,本町一丁目,-,渋谷区本町１−１９−３,35.679004,139.679671,グローバルキッズ幡ヶ谷園,認可,88,2022年10月1日時点
渋谷区,本町一丁目,-,渋谷区本町１−５−５,35.681236,139.684236,本町第三保育園,認可,115,2022年10月1日時点
渋谷区,本町二丁目,-,渋谷区本町２−６−３　２階,35.683,139.683376,AIAI　NURSERY　初台本町,認可,50,2022年10月1日時点
渋谷区,本町五丁目,-,渋谷区本町５−３５−１２,35.683209,139.676085,幡ヶ谷保育園,認可,92,2022年10月1日時点
渋谷区,本町六丁目,-,渋谷区本町６−３４−６,35.680427,139.677854,ベネッセ幡ヶ谷保育園,認可,69,2022年10月1日時点
渋谷区,幡ケ谷二丁目,-,渋谷区幡ヶ谷２−４２−１５,35.677877,139.674074,まなびの森保育園幡ヶ谷,認可,102,2022年10月1日時点
渋谷区,幡ケ谷二丁目,-,渋谷区幡ヶ谷２−５６−６,35.677887,139.671622,幡ヶ谷第三保育園,認可,73,2022年10月1日時点
渋谷区,幡ケ谷三丁目,-,渋谷区幡ヶ谷３−４−１,35.679819,139.675984,幡ヶ谷第二保育園,認可,72,2022年10月1日時点
渋谷区,笹塚一丁目,-,渋谷区笹塚１−２７−１,35.672221,139.667252,笹塚第二保育園,認可,121,2022年10月1日時点
渋谷区,笹塚一丁目,-,渋谷区笹塚１−３２−５,35.6725,139.66687,さくらさくみらい　笹塚,認可,80,2022年10月1日時点
渋谷区,笹塚二丁目,-,渋谷区笹塚２−３１−８,35.674468,139.663801,保育園うさぎとかめ,認可,123,2022年10月1日時点
渋谷区,笹塚二丁目,-,渋谷区笹塚２−３４−１２,35.675222,139.66451,笹幡保育園,認可,123,2022年10月1日時点
渋谷区,笹塚三丁目,-,渋谷区笹塚３−３６−１３,35.677212,139.665917,笹塚保育園,認可,80,2022年10月1日時点
千代田区,九段北四丁目,-,千代田区九段北四丁目2番地22号市ヶ谷スポーツプラザ1階,35.691872,139.737221,保育園　ドルチェ,認証A,40,2023年2月1日時点
千代田区,丸の内二丁目,大丸有,千代田区丸の内2-7-3,35.678597,139.764992,キッズスクウェア丸の内東京ビル,認証A,22,2023年2月1日時点
千代田区,内神田二丁目,-,千代田区内神田2-5-2,35.69012,139.767533,マミーズエンジェル神田駅前保育園,認証A,38,2023年2月1日時点
千代田区,神田神保町二丁目,-,千代田区神田神保町2-20ＳＰ神保町第2ビル1階,35.697211,139.756614,小学館アカデミー神保町保育園,認証A,40,2023年2月1日時点
千代田区,五番町,-,千代田区五番町5-6ビラカーサ五番町101号,35.689881,139.73623,ピノキオ幼児舎番町園,認証A,26,2023年2月1日時点
千代田区,永田町二丁目,赤坂,千代田区永田町2丁目1番2号衆議院第二議員会館内,35.675585,139.742797,キッズスクウェア　永田町,認証A,34,2023年2月1日時点
千代田区,丸の内一丁目,大丸有,千代田区丸の内1-4-1丸の内永楽ビルディング2階,35.684451,139.764942,キッズスクウェア　丸の内永楽ビル,認証A,26,2023年2月1日時点
千代田区,外神田二丁目,-,千代田区外神田2-17-4ビルデンス石村1階,35.701299,139.76758,保育室「愛の園」,認証A,32,2023年2月1日時点
中央区,月島一丁目,-,中央区月島一丁目3番2号佃権月島ビル3階,35.664882,139.783811,ちゃいれっく月島駅前保育園,認証A,50,2023年2月1日時点
中央区,晴海一丁目,-,中央区晴海1-8ー16晴海トリトン2階,35.657472,139.782381,アスク晴海保育園,認証A,60,2023年2月1日時点
中央区,月島一丁目,-,中央区月島1-2-13ワイズビルディング1階,35.665651,139.783075,マミーズエンジェル月島保育園,認証A,33,2023年2月1日時点
中央区,日本橋人形町三丁目,-,中央区日本橋人形町3-4-14　KDX人形町ビル2階,35.686127,139.781346,アスク人形町駅前保育園,認証A,40,2023年2月1日時点
中央区,月島四丁目,-,中央区月島4-18-3クイーンズハウス1階,35.659541,139.782003,ピノキオ幼児舎月島園,認証A,20,2023年2月1日時点
中央区,銀座一丁目,-,中央区銀座1-25-3京橋プラザ区民館等複合施設1階,35.672998,139.771517,ポピンズナーサリースクール京橋,認証A,40,2023年2月1日時点
中央区,日本橋箱崎町,-,中央区日本橋箱崎町44-7箱崎ＹＭビル,35.681791,139.788863,グローバルキッズ水天宮前園,認証A,40,2023年2月1日時点
中央区,月島三丁目,-,中央区月島3-1-11,35.663785,139.779486,ポピンズナーサリースクール月島,認証A,30,2023年2月1日時点
中央区,新川二丁目,-,中央区新川2丁目16番10号プライムアーバン新川3Ｆ,35.6751,139.78263,グローバルキッズ新川園,認証A,40,2023年2月1日時点
中央区,月島二丁目,-,中央区月島2丁目18番2号,35.662268,139.784479,さくらさくみらい　月島,認証A,34,2023年2月1日時点
中央区,勝どき一丁目,-,中央区勝どき1-1-1プラザ勝どき1階,35.661224,139.776723,ニチイキッズさわやかプラザ勝どき保育園,認証A,60,2023年2月1日時点
中央区,日本橋浜町三丁目,-,中央区日本橋浜町3-3-1トルナーレ日本橋浜町2階,35.684671,139.787746,ニチイキッズさわやか日本橋浜町保育園,認証A,29,2023年2月1日時点
港区,芝五丁目,-,港区芝五丁目29番22号ライオンズプラザ・フェリス三田1階,35.64638,139.744639,三田プチ･クレイシュ,認証A,33,2023年2月1日時点
港区,三田二丁目,-,港区三田二丁目7番13号,35.651416,139.744536,ゆらりん三田保育園,認証A,20,2023年2月1日時点
港区,台場二丁目,-,港区台場2-2-3,35.630022,139.780209,アスクお台場保育園,認証A,30,2023年2月1日時点
港区,白金台三丁目,-,港区白金台三丁目15番6号2階,35.636573,139.724405,コンビプラザ白金台保育園,認証A,29,2023年2月1日時点
港区,芝浦四丁目,-,港区芝浦四丁目22番2号エアテラス2階,35.641081,139.752822,アンジェリカ保育園芝浦園,認証A,40,2023年2月1日時点
港区,芝四丁目,-,港区芝4-16-1カテリーナ三田1階,35.647494,139.750347,プチ・ナーサリー田町,認証A,40,2023年2月1日時点
港区,三田四丁目,-,港区三田4-9-7BPRレジデンス三田伊皿子坂2階,35.641395,139.737831,ポピンズナーサリースクール高輪,認証A,36,2023年2月1日時点
港区,芝浦四丁目,-,港区芝浦4-10-1キャピタルマークタワー2階,35.641098,139.746414,ポピンズナーサリースクール芝浦,認証A,34,2023年2月1日時点
港区,白金台四丁目,-,港区白金台4丁目8番16号ダリアコート白金台1階101号室,35.637508,139.72437,ポピンズナーサリースクール白金台,認証A,30,2023年2月1日時点
港区,港南二丁目,-,港区港南2丁目3番13号品川フロントビルキッズ館2F,35.629169,139.743212,アンジェリカ保育園品川園,認証A,40,2023年2月1日時点
港区,南麻布五丁目,-,港区南麻布5-1-11Ｑｉｚ広尾3階,35.655012,139.722546,ポピンズナーサリースクール広尾,認証A,66,2023年2月1日時点
港区,東麻布一丁目,-,港区東麻布1-26-2SERAPH10AZABU1・2階,35.655418,139.744803,ゆらりん東麻布保育園,認証A,30,2023年2月1日時点
港区,南麻布五丁目,-,港区南麻布5-6-8,35.653449,139.727096,ナーサリールーム,認証A,35,2023年2月1日時点
港区,赤坂一丁目,虎ノ門,港区赤坂1-8-1赤坂インターシティAIR2階,35.669981,139.742582,ポピンズナーサリースクール赤坂,認証A,30,2023年2月1日時点
港区,麻布十番一丁目,-,港区麻布十番１−１０−３　モンテプラザ２階,35.656209,139.736306,ニチイキッズさわやか麻布十番保育園,認証A,30,2023年2月1日時点
港区,白金一丁目,-,港区白金１−２５−２５,35.643783,139.731451,ニチイキッズさわやか白金高輪保育園,認証A,20,2023年2月1日時点
港区,港南四丁目,-,港区港南４−２−５　シティタワー品川　西棟２・３階,35.631357,139.747298,ニチイキッズさわやか港南保育園,認証A,73,2023年2月1日時点
新宿区,富久町,-,新宿区富久町13番1号ローレルコート新宿タワー2階,35.69241,139.71472,エデュケアセンター・新宿,認証A,22,2023年2月1日時点
新宿区,改代町,-,新宿区改代町26番1号,35.707862,139.734274,ソラスト神楽坂,認証A,40,2023年2月1日時点
新宿区,西早稲田一丁目,-,新宿区西早稲田1-1-7,35.707453,139.719309,ポピンズナーサリースクール早稲田,認証A,54,2023年2月1日時点
新宿区,北新宿三丁目,-,新宿区北新宿3-2-1レグノ・セレーノ１F,35.702975,139.69467,北新宿雲母保育園,認証A,40,2023年2月1日時点
新宿区,高田馬場四丁目,-,新宿区高田馬場4丁目23番28号ヒルズISHIDA1Ｆ,35.710241,139.702063,キッズパオ高田馬場あおぞら園,認証A,28,2023年2月1日時点
