指標名,保育園,,,認可保育所,https://www.fukushihoken.metro.tokyo.lg.jp/kiban/fukushi_shisetsu/shs_list/index.html,,,,
出典,東京都福祉保健局,,,認証保育所,https://www.fukushihoken.metro.tokyo.lg.jp/kodomo/hoiku/ninsyo/ichiran.html,,,,
年次,2023/2/21取得,,,こども園,https://www.fukushihoken.metro.tokyo.lg.jp/kodomo/hoiku/n_kodomoen/shisetsuichiran.html,,,,
URL,右記参照,,,認可外保育施設,https://www.fukushihoken.metro.tokyo.lg.jp/kodomo/hoiku/ninkagai/index.html,,,,
備考,（2021年度：1073件、2022年度；1080件）,,,,,,,,
,,,,,,,,,
区,町丁,エリア,住所,緯度,経度,施設名,種別,定員,データ時点
千代田区,外神田四丁目,-,千代田区外神田４−８−６,35.702695,139.772766,ほっぺるランド外神田,認可,87,2022年10月1日時点
千代田区,外神田三丁目,-,千代田区外神田三丁目６番１３号,35.70246,139.76986,外神田かなりや保育園,認可,50,2022年10月1日時点
千代田区,神田和泉町,-,千代田区神田和泉町１,35.699154,139.778474,いずみこども園,認可,36,2022年10月1日時点
千代田区,東神田二丁目,-,千代田区東神田２−６−５　東神田ビル２・３階,35.695855,139.780285,あい保育園東神田,認可,63,2022年10月1日時点
千代田区,岩本町二丁目,-,千代田区岩本町二丁目１０番１２号,35.693687,139.77671,岩本町ちとせ保育園,認可,70,2022年10月1日時点
千代田区,神田岩本町,-,千代田区神田岩本町１５−７,35.696679,139.775092,千代田せいが保育園,認可,51,2022年10月1日時点
千代田区,神田美倉町,-,千代田区神田美倉町１０−２,35.690838,139.774452,保育園神田ベアーズ,認可,72,2022年10月1日時点
千代田区,内神田二丁目,-,千代田区内神田２−１−１３,35.689011,139.768395,ベネッセ内神田保育園,認可,60,2022年10月1日時点
千代田区,神田淡路町二丁目,-,千代田区神田淡路町２−１０９,35.696812,139.767009,神田保育園,認可,120,2022年10月1日時点
千代田区,神田淡路町二丁目,-,千代田区神田淡路町２−１２,35.697841,139.768764,神田淡路町保育園大きなおうち,認可,99,2022年10月1日時点
千代田区,西神田二丁目,-,千代田区西神田２−６−２　西神田コスモス館,35.69888,139.75488,西神田保育園,認可,99,2022年10月1日時点
千代田区,西神田三丁目,-,千代田区西神田３−５−２　千代田ファーストビル西館１階,35.698279,139.753189,ほっぺるランド西神田,認可,70,2022年10月1日時点
千代田区,富士見一丁目,-,千代田区富士見１−１０−３,35.696941,139.746213,ふじみこども園,認可,55,2022年10月1日時点
千代田区,富士見二丁目,-,千代田区富士見２−１４−３６　富士見ウエスト２・３階,35.697163,139.743821,グローバルキッズ飯田橋園,認可,138,2022年10月1日時点
千代田区,九段北四丁目,-,千代田区九段北４−２−２９　セブンアネックス１〜３階,35.692525,139.738466,クレアナーサリー市ヶ谷,認可,78,2022年10月1日時点
千代田区,三番町,-,千代田区三番町１４−６,35.690682,139.742009,AIAI NURSERY 三番町,認可,50,2022年10月1日時点
千代田区,四番町,-,千代田区四番町５−８,35.688301,139.736605,四番町保育園,認可,97,2022年10月1日時点
千代田区,一番町,-,千代田区一番町１０−８　一番町ウエストビル３・４階,35.686586,139.739776,ポピンズナーサリースクール一番町,認可,80,2022年10月1日時点
千代田区,一番町,-,千代田区一番町４,35.688001,139.74263,麹町保育園,認可,100,2022年10月1日時点
千代田区,二番町,-,千代田区二番町２−１　二番町ＴＳビル１〜３階,35.686959,139.737971,アスク二番町保育園,認可,100,2022年10月1日時点
千代田区,二番町,-,千代田区二番町７−５,35.685498,139.735174,二番町ちとせ保育園,認可,100,2022年10月1日時点
千代田区,六番町,-,千代田区六番町５−１６,35.686907,139.734698,グローバルキッズ六番町園,認可,60,2022年10月1日時点
千代田区,平河町二丁目,-,千代田区平河町２−１０−３,35.680806,139.740295,平河町ちとせ保育園,認可,75,2022年10月1日時点
中央区,日本橋小伝馬町,-,中央区日本橋小伝馬町１３−７　銀泉日本橋小伝馬町ビル１〜４Ｆ,35.691162,139.779608,にじいろ保育園小伝馬町,認可,72,2022年10月1日時点
中央区,日本橋小伝馬町,-,中央区日本橋小伝馬町５−１,35.69094,139.776983,十思保育園,認可,94,2022年10月1日時点
中央区,東日本橋一丁目,-,中央区東日本橋１−４−６　東日本橋一丁目ビル１・２Ｆ,35.691021,139.786182,テンダーラビング保育園東日本橋,認可,70,2022年10月1日時点
中央区,東日本橋一丁目,-,中央区東日本橋１−５−１３　セイワ東日本橋ビル１〜４階,35.691133,139.785957,ミアヘルサ保育園ひびき東日本橋,認可,90,2022年10月1日時点
中央区,東日本橋三丁目,-,中央区東日本橋３−３−３　Ａｎｅｌａビル１〜３階,35.691226,139.782194,ほっぺるランド東日本橋,認可,72,2022年10月1日時点
中央区,日本橋三丁目,日八京,中央区東日本橋３−６−１５,35.679482,139.772595,さくらさくみらい　東日本橋,認可,58,2022年10月1日時点
中央区,日本橋久松町,-,中央区日本橋久松町９−４,35.688782,139.785418,ナーサリールーム　ベリーベアー日本橋,認可,70,2022年10月1日時点
中央区,日本橋富沢町,-,中央区日本橋富沢町１０−１８　日本橋富沢町スクエア２Ｆ,35.689506,139.781943,かふう保育園日本橋,認可,70,2022年10月1日時点
中央区,日本橋富沢町,-,中央区日本橋富沢町２−６,35.68792,139.78376,さくらさくみらい人形町,認可,74,2022年10月1日時点
中央区,日本橋富沢町,-,中央区日本橋富沢町４−１　ミズホビル１Ｆ・２Ｆ,35.687785,139.782869,まちのてらこや保育園,認可,30,2022年10月1日時点
中央区,日本橋富沢町,-,中央区日本橋富沢町９−１０　稲村ビル１階,35.689499,139.782821,あい保育園日本橋,認可,60,2022年10月1日時点
中央区,日本橋浜町一丁目,-,中央区日本橋浜町１−９−１２　日本橋プラヤビル２階,35.690225,139.787855,AIAI NURSERY 日本橋浜町,認可,50,2022年10月1日時点
中央区,日本橋浜町二丁目,-,中央区日本橋浜町２−４４−４　第１７村上ビル１・２Ｆ,35.687585,139.788124,キッズハウス浜町公園,認可,48,2022年10月1日時点
中央区,日本橋浜町三丁目,-,中央区日本橋浜町３−３７−１,35.685474,139.791284,浜町保育園,認可,125,2022年10月1日時点
中央区,日本橋浜町三丁目,-,中央区日本橋浜町３−４０−３　パークホームズ日本橋浜町ザレジデンス１階・２階,35.6863568,139.790612,グローバルキッズ浜町園,認可,45,2022年10月1日時点
中央区,日本橋堀留町一丁目,-,中央区日本橋堀留町１−１−１−２Ｆ,35.687408,139.778996,堀留町保育園,認可,81,2022年10月1日時点
中央区,日本橋堀留町二丁目,-,中央区日本橋堀留町２−８−４　日本橋コアビル１階,35.688488,139.781388,ほっぺるランド日本橋堀留町,認可,70,2022年10月1日時点
中央区,日本橋人形町二丁目,-,中央区日本橋人形町２−１４−５,35.684603,139.784826,人形町保育園,認可,105,2022年10月1日時点
中央区,日本橋人形町三丁目,-,中央区日本橋人形町３−７−５　ＩＫＴビル１〜４Ｆ,35.686625,139.781411,モニカ人形町園,認可,60,2022年10月1日時点
中央区,日本橋蛎殻町一丁目,-,中央区日本橋蛎殻町１−１−２,35.680857,139.783494,日本橋保育園,認可,91,2022年10月1日時点
中央区,日本橋蛎殻町一丁目,-,中央区日本橋蛎殻町１−１６−１１　ＥＤＧＥ日本橋蛎殻町１・２階,35.683098,139.782587,グローバルキッズかきがら園,認可,45,2022年10月1日時点
中央区,日本橋蛎殻町一丁目,-,中央区日本橋蛎殻町１−２９−９　ネオテック水天宮ビル１・２階,35.683132,139.78394,あい保育園水天宮,認可,90,2022年10月1日時点
中央区,日本橋蛎殻町一丁目,-,中央区日本橋蛎殻町１−３５−５　セイラン水天宮ビル１・２階,35.681745,139.786077,キッズラボ水天宮前園,認可,56,2022年10月1日時点
中央区,日本橋蛎殻町二丁目,-,中央区日本橋蛎殻町２−１５−５　水天宮ＣＰビル１〜４Ｆ,35.684316,139.786896,THREE　STAR　NURSERY蛎殻町園,認可,156,2022年10月1日時点
中央区,日本橋箱崎町,-,中央区日本橋箱崎町１７ー９　箱崎升喜ビル１・２階,35.680607,139.785087,コビープリスクールはこざき,認可,70,2022年10月1日時点
中央区,日本橋茅場町二丁目,-,中央区日本橋茅場町２−１６−６,35.678166,139.779924,ほっぺるランド茅場町,認可,75,2022年10月1日時点
中央区,日本橋三丁目,日八京,中央区日本橋３−１５−１０,35.678738,139.775033,ＥＤＯ日本橋保育園,認可,60,2022年10月1日時点
中央区,八丁堀四丁目,-,中央区八丁堀４−５−１０,35.673996,139.775865,八丁堀保育園,認可,79,2022年10月1日時点
中央区,新川一丁目,-,中央区新川１−２４−１　ユニゾ新川永代通りビル２階,35.676814,139.7852,太陽の子新川保育園,認可,95,2022年10月1日時点
中央区,新川一丁目,-,中央区新川１−２６−９　新川イワデビル１．２階,35.676085,139.784253,あい保育園新川,認可,80,2022年10月1日時点
中央区,新川二丁目,-,中央区新川２−３０−３,35.67282,139.782977,ミアヘルサ保育園ひびき八丁堀,認可,80,2022年10月1日時点
中央区,入船一丁目,-,中央区入船１−１−１３,35.673746,139.778221,桜川保育園,認可,131,2022年10月1日時点
中央区,入船三丁目,-,中央区入船３−５−１０　藤和入船ビル２Ｆ,35.670803,139.776271,ブライト保育園東京入船,認可,40,2022年10月1日時点
中央区,湊一丁目,-,中央区湊１−２−９　ＴＫオフィスビルディング１〜４Ｆ,35.672965,139.778847,ＴＫチルドレンズファーム湊校,認可,66,2022年10月1日時点
中央区,明石町,-,中央区明石町１２−１,35.666635,139.776739,明石町保育園,認可,128,2022年10月1日時点
中央区,明石町,-,中央区明石町７−１５　ぱぱす明石町ビル２・３階,35.667069,139.774833,ぽけっとランド明石町保育園,認可,91,2022年10月1日時点
中央区,築地三丁目,-,中央区築地３−１０−７,35.667663,139.772632,さくらさくみらい築地,認可,48,2022年10月1日時点
中央区,築地六丁目,-,中央区築地４−１５−１,35.664087,139.771598,築地保育園,認可,123,2022年10月1日時点
中央区,佃一丁目,-,中央区佃１−１０−７　コンフォール月島１ー３階,35.6674179,139.7840097,さくらさくみらいつくだ大通り,認可,70,2022年10月1日時点
中央区,佃一丁目,-,中央区佃１−１１−８　ピアウエストスクエアノースウイング２階,35.669705,139.784422,ほっぺるランド佃,認可,92,2022年10月1日時点
中央区,佃一丁目,-,中央区佃１−４−８,35.6669934,139.7825916,さくらさくみらい佃,認可,63,2022年10月1日時点
中央区,佃二丁目,-,中央区佃２−１０−９　ライオンズタワー月島１Ｆ,35.666154,139.784459,保育所まぁむ月島駅前園,認可,80,2022年10月1日時点
中央区,佃二丁目,-,中央区佃２−２−２,35.666852,139.786975,つくだ保育園,認可,131,2022年10月1日時点
中央区,佃二丁目,-,中央区佃２−２２−２,35.666499,139.786748,みちてる保育園,認可,64,2022年10月1日時点
中央区,月島一丁目,-,中央区月島１−１−１３　プライマル月島１階・２階,35.6665342,139.7820724,ほっぺるランド佃大橋,認可,76,2022年10月1日時点
中央区,月島一丁目,-,中央区月島１−５−２　キャピタルゲートプレイス２階,35.664162,139.783695,太陽の子月島保育園,認可,95,2022年10月1日時点
中央区,月島二丁目,-,中央区月島２−１０−３,35.663248,139.783922,月島保育園,認可,128,2022年10月1日時点
中央区,月島二丁目,-,中央区月島２−１３−５　オルフェ月島ビル２・３階,35.662773,139.783594,アンジェリカ月島保育園,認可,100,2022年10月1日時点
中央区,月島三丁目,-,中央区月島３−２６−１１　レジデンスシャルマン月島１階,35.661956,139.778907,月島雲母保育園,認可,60,2022年10月1日時点
中央区,月島一丁目,-,中央区月島４−３−１４,35.66359,139.781823,さくらさくみらい東仲通り,認可,74,2022年10月1日時点
中央区,月島四丁目,-,中央区月島４−４−１１,35.660878,139.783422,さくらさくみらい　月の岬,認可,65,2022年10月1日時点
中央区,月島一丁目,-,中央区月島４−５−８,35.66359,139.781823,月島聖ルカ保育園,認可,102,2022年10月1日時点
中央区,晴海一丁目,-,中央区晴海１−５−１５,35.659658,139.784443,晴海保育園,認可,107,2022年10月1日時点
中央区,晴海一丁目,-,中央区晴海１−８−２　晴海トリトンスクエア展示棟３階,35.6573718,139.7827814,太陽の子晴海トリトン保育園,認可,49,2022年10月1日時点
中央区,晴海二丁目,-,中央区晴海２−１−４０　晴海フロント２階,35.655903,139.784001,ポピンズナーサリースクール晴海,認可,96,2022年10月1日時点
中央区,晴海二丁目,-,中央区晴海２−５−２４　晴海センタービル１階,35.655466,139.782861,さくらさくみらい晴海,認可,26,2022年10月1日時点
中央区,晴海三丁目,-,中央区晴海３−１０−１　Ｄａｉｗａ晴海ビル１Ｆ,35.654046,139.779226,アスク晴海３丁目保育園,認可,45,2022年10月1日時点
中央区,晴海三丁目,-,中央区晴海３−６−８　スカイリンクタワー２Ｆ,35.655784,139.778907,小学館アカデミー晴海保育園,認可,78,2022年10月1日時点
中央区,勝どき一丁目,-,中央区勝どき１−４−１,35.660312,139.777206,勝どき保育園,認可,143,2022年10月1日時点
中央区,勝どき一丁目,-,中央区勝どき１−８−１−３Ｆ,35.65962,139.776884,かちどき西保育園,認可,120,2022年10月1日時点
中央区,勝どき二丁目,-,中央区勝どき２−１６−３,35.657795,139.778472,勝どきちとせ保育園,認可,80,2022年10月1日時点
中央区,勝どき三丁目,-,中央区勝どき３−３−７　ＫＮリバーシティ２階,35.659255,139.774927,まなびの森保育園勝どき,認可,70,2022年10月1日時点
中央区,勝どき三丁目,-,中央区勝どき３−４−４,35.659064,139.775746,ほっぺるランド勝どき,認可,130,2022年10月1日時点
中央区,勝どき三丁目,-,中央区勝どき３−７−２,35.6578814,139.7751623,ほっぺるランド清澄通り勝どき,認可,94,2022年10月1日時点
中央区,勝どき四丁目,-,中央区勝どき４−８−１４,35.656884,139.775594,アスク勝どき保育園,認可,76,2022年10月1日時点
中央区,勝どき五丁目,-,中央区勝どき５−１−１７　勝どきザ・リバーフロント２Ｆ,35.658032,139.772516,ベネッセ勝どき保育園,認可,45,2022年10月1日時点
中央区,勝どき五丁目,-,中央区勝どき５−２−１５　ＥＤＧＥ勝どき１・２階,35.657236,139.773395,ほっぺるランド新島橋かちどき,認可,114,2022年10月1日時点
中央区,勝どき六丁目,-,中央区勝どき６−１−９,35.655955,139.774563,勝どきえほん保育園,認可,90,2022年10月1日時点
中央区,勝どき六丁目,-,中央区勝どき６−３−１　ザ・トーキョータワーズシータワー３階,35.655764,139.77355,ニチイキッズさわやか勝どき６丁目保育園,認可,105,2022年10月1日時点
中央区,銀座一丁目,-,中央区銀座１−１２−６,35.674373,139.76996,まなびの森保育園銀座,認可,93,2022年10月1日時点
港区,虎ノ門三丁目,虎ノ門,港区虎ノ門三丁目１９番１３号　虎ノ門スピリットビル３階,35.66308,139.746801,グローバルキッズ虎ノ門保育園,認可,56,2022年10月1日時点
港区,新橋六丁目,虎ノ門広域,港区新橋六丁目１１番１３号,35.6615998,139.7546065,にじいろ保育園新橋,認可,27,2022年10月1日時点
港区,新橋六丁目,虎ノ門広域,港区新橋六丁目４番３号　ル・グラシエルビル７号館２階,35.662278,139.75404,こころ新橋保育園,認可,60,2022年10月1日時点
港区,芝公園二丁目,-,港区芝公園二丁目７番３号,35.654204,139.750654,芝公園保育園,認可,154,2022年10月1日時点
港区,浜松町一丁目,-,港区浜松町一丁目１番１１号,35.6599882,139.7554066,汐留サーノ保育園,認可,80,2022年10月1日時点
港区,浜松町一丁目,-,港区浜松町一丁目３番１号,35.659878,139.756993,小鳩ナーサリースクール浜離宮,認可,41,2022年10月1日時点
港区,浜松町一丁目,-,港区浜松町一丁目６番７号,35.658702,139.757622,神明保育園,認可,170,2022年10月1日時点
港区,芝四丁目,-,港区芝二丁目１２番１６号,35.64964,139.749875,アスク芝公園保育園,認可,60,2022年10月1日時点
港区,芝二丁目,-,港区芝二丁目１番２７号　穴水ビル２階,35.653349,139.751196,ニチイキッズ芝公園保育園,認可,45,2022年10月1日時点
港区,海岸一丁目,-,港区海岸１−１３−１５,35.654328,139.761678,にじいろ保育園竹芝,認可,32,2022年10月1日時点
港区,芝浦一丁目,-,港区芝浦一丁目２番２号　シーバンスアモール３階,35.649863,139.756388,太陽の子シーバンス保育園,認可,100,2022年10月1日時点
港区,芝浦一丁目,-,港区芝浦一丁目６番４１号　グローバルフロントタワー１階,35.647544,139.755174,アンジェリカ田町保育園,認可,60,2022年10月1日時点
港区,芝浦一丁目,-,港区芝浦一丁目９番７号　芝浦おもだかビル２階、３階,35.648128,139.753489,太陽の子芝浦一丁目保育園,認可,66,2022年10月1日時点
港区,西麻布二丁目,-,港区西麻布二丁目１３番３号,35.660892,139.72279,西麻布保育園,認可,133,2022年10月1日時点
港区,西麻布二丁目,-,港区西麻布二丁目２番２号　ＮＫホームズ１階Ｂ,35.66122,139.720629,コスモス西麻布保育園,認可,50,2022年10月1日時点
港区,六本木四丁目,六本木,港区六本木４−５−１１,35.664766,139.732451,ｓａｋｕｒａ保育園六本木,認可,40,2022年10月1日時点
港区,六本木五丁目,六本木,港区六本木６−５−２７,35.661859,139.734547,リトルパルズ保育園六本木,認可,48,2022年10月1日時点
港区,六本木一丁目,虎ノ門,港区六本木一丁目９番１０号　アークヒルズ仙石山森タワー,35.663662,139.741763,まちの保育園六本木,認可,70,2022年10月1日時点
港区,六本木五丁目,六本木,港区六本木五丁目１６番４６号,35.661228,139.735143,麻布保育園,認可,154,2022年10月1日時点
港区,東麻布一丁目,-,港区東麻布一丁目２１番２号,35.655633,139.742231,飯倉保育園,認可,140,2022年10月1日時点
港区,東麻布一丁目,-,港区東麻布一丁目５番６号,35.655633,139.742231,ふたばクラブ東麻布保育園,認可,59,2022年10月1日時点
港区,東麻布二丁目,-,港区東麻布二丁目１番１号,35.656068,139.741572,東麻布保育園,認可,171,2022年10月1日時点
港区,東麻布二丁目,-,港区東麻布二丁目３２番７号　麻布アコービル２階,35.6559585,139.7404942,AIAI NURSERY麻布十番,認可,70,2022年10月1日時点
港区,麻布十番一丁目,-,港区麻布十番一丁目３番２号,35.656991,139.735836,麻布十番ちとせ保育園,認可,49,2022年10月1日時点
港区,元麻布三丁目,-,港区元麻布三丁目２番１９号　ＭＯＭＯＮ六本木ビル２階,35.657418,139.727323,あい保育園元麻布,認可,60,2022年10月1日時点
港区,元麻布二丁目,-,港区元麻布二丁目１４番１２号,35.652968,139.73038,元麻布保育園,認可,180,2022年10月1日時点
港区,南麻布一丁目,-,港区南麻布一丁目１４番１号,35.651137,139.734086,まなびの森保育園麻布十番,認可,50,2022年10月1日時点
港区,南麻布一丁目,-,港区南麻布一丁目８番１１号（東町小学校内）,35.650871,139.735833,まなびの森保育園麻布,認可,60,2022年10月1日時点
港区,南麻布四丁目,-,港区南麻布四丁目１１番３０号　南麻布渋谷ビル２階,35.647023,139.727163,太陽の子南麻布保育園,認可,70,2022年10月1日時点
港区,南麻布四丁目,-,港区南麻布四丁目２番２９号,35.647745,139.724129,南麻布保育園,認可,105,2022年10月1日時点
港区,南麻布三丁目,-,港区南麻布四丁目６番７号,35.649991,139.730715,本村保育園,認可,114,2022年10月1日時点
港区,南麻布二丁目,-,港区南麻布二丁目１１番１０号　ＯＪビル３階,35.647684,139.735784,あい保育園南麻布,認可,130,2022年10月1日時点
港区,赤坂五丁目,赤坂,港区赤坂五丁目５番２６号,35.671049,139.734025,赤坂保育園,認可,105,2022年10月1日時点
港区,赤坂四丁目,赤坂,港区赤坂四丁目１番２６号,35.676397,139.734702,赤坂山王保育園,認可,99,2022年10月1日時点
港区,赤坂四丁目,赤坂,港区赤坂四丁目７番１５号　陽栄光和ビル１階,35.675465,139.734029,赤坂ちとせ保育園,認可,50,2022年10月1日時点
港区,赤坂四丁目,赤坂,港区赤坂四丁目９番３号,35.675472,139.732987,赤坂クレア保育園,認可,52,2022年10月1日時点
港区,赤坂八丁目,赤坂,港区赤坂八丁目１２番１６号　ＮＯＺＹ　ＡＫＡＳＡＫＡ１階、２階、３階,35.66991,139.73058,太陽の子赤坂保育園,認可,60,2022年10月1日時点
港区,北青山三丁目,-,港区北青山三丁目４番１号,35.666948,139.712444,青山保育園,認可,130,2022年10月1日時点
港区,北青山三丁目,-,港区北青山三丁目４番３号,35.667575,139.713351,おはよう保育園　ののあおやま,認可,23,2022年10月1日時点
港区,南青山一丁目,-,港区南青山一丁目３番１５号,35.671088,139.72546,南青山保育園,認可,142,2022年10月1日時点
港区,南青山一丁目,-,港区南青山一丁目３番１号　パークアクシス青山一丁目タワー２階,35.671587,139.725371,あい保育園青山一丁目,認可,60,2022年10月1日時点
港区,南青山四丁目,-,港区南青山四丁目１５番８号　南青山２４６ビル,35.664916,139.718304,小学館アカデミー南青山保育園,認可,50,2022年10月1日時点
港区,南青山四丁目,-,港区南青山四丁目１番６号　セブン南青山１階２階,35.667322,139.719162,太陽の子南青山保育園,認可,60,2022年10月1日時点
港区,芝五丁目,-,港区芝五丁目１８番１号,35.648302,139.747765,芝保育園,認可,168,2022年10月1日時点
港区,海岸三丁目,-,港区海岸三丁目１６番６号,35.642496,139.755864,にじいろ保育園海岸三丁目,認可,101,2022年10月1日時点
港区,芝浦三丁目,-,港区芝浦三丁目１番１６号,35.645149,139.750212,しばうら保育園,認可,263,2022年10月1日時点
港区,芝浦三丁目,-,港区芝浦三丁目２０番２号　山楽ビル２階、３階,35.642222,139.746542,太陽の子芝浦三丁目保育園,認可,52,2022年10月1日時点
港区,芝浦四丁目,-,港区芝浦四丁目１２番２８号,35.639562,139.749072,アスク芝浦４丁目保育園,認可,60,2022年10月1日時点
港区,芝浦四丁目,-,港区芝浦四丁目１７番３号　芝浦ＮＡビル３階,35.637015,139.747127,デイジー保育園芝浦,認可,54,2022年10月1日時点
港区,芝浦二丁目,-,港区芝浦二丁目３番３１号　第二高取ビル２階,35.644118,139.754544,にじのいるか保育園芝浦,認可,60,2022年10月1日時点
港区,芝浦二丁目,-,港区芝浦二丁目９番１号　ブランズタワー芝浦２階,35.645143,139.75271,太陽の子芝浦二丁目保育園,認可,50,2022年10月1日時点
港区,白金台四丁目,-,港区白金台３−１３−１８,35.638758,139.725607,あい保育園白金台,認可,45,2022年10月1日時点
港区,白金台二丁目,-,港区白金台二丁目１１番３号,35.633194,139.730732,えほんのもり白金台保育園,認可,35,2022年10月1日時点
港区,白金台二丁目,-,港区白金台二丁目２６番１０号　グリーンオーク高輪台２階,35.631745,139.730039,ニチイキッズ白金台保育園,認可,70,2022年10月1日時点
港区,白金一丁目,-,港区白金一丁目２６番１０号　白金Ｋ−ＦＬＡＴ１階、２階の一部,35.643931,139.733237,ゆらりん白金保育園,認可,50,2022年10月1日時点
港区,白金三丁目,-,港区白金三丁目１０番１２号,35.644902,139.731102,白金保育園,認可,107,2022年10月1日時点
