指標名,保育園,,,認可保育所,https://www.fukushihoken.metro.tokyo.lg.jp/kiban/fukushi_shisetsu/shs_list/index.html,,,,
江東区,豊洲三丁目,-,江東区豊洲三丁目５番２１−１０２号,35.654589,139.79652,蓮美幼児学園とよすナーサリー,認可,134,2022年10月1日時点
江東区,豊洲三丁目,-,江東区豊洲三丁目５番３号,35.654589,139.79652,蓮美幼児学園第２とよすナーサリー,認可,87,2022年10月1日時点
江東区,豊洲四丁目,-,江東区豊洲四丁目１０番１−１０６号,35.653792,139.80131,ゆらりん豊四保育園,認可,75,2022年10月1日時点
江東区,豊洲三丁目,-,江東区豊洲四丁目１１番２０−１３８号,35.654589,139.79652,ひまわりキッズガーデン豊洲,認可,91,2022年10月1日時点
江東区,豊洲三丁目,-,江東区豊洲四丁目１番２４号,35.654589,139.79652,ミアヘルサ保育園ひびき豊洲,認可,120,2022年10月1日時点
江東区,豊洲三丁目,-,江東区豊洲四丁目５番８号,35.654589,139.79652,江東区豊洲保育園,認可,130,2022年10月1日時点
江東区,豊洲二丁目,-,江東区豊洲二丁目５番３−１０１号,35.6583609,139.7922006,ＭＩＷＡシンフォニア保育園,認可,120,2022年10月1日時点
江東区,東雲一丁目,-,江東区東雲１−１０−１４,35.650661,139.802414,グローバルキッズしののめ園,認可,81,2022年10月1日時点
江東区,東雲一丁目,-,江東区東雲１−８−５−１０１,35.644941,139.800236,江東区東雲保育園,認可,77,2022年10月1日時点
江東区,東雲二丁目,-,江東区東雲２−１−２２,35.643794,139.801499,みんなのみらいをつくる保育園東雲,認可,50,2022年10月1日時点
江東区,東雲二丁目,-,江東区東雲２−４−４−１０３,35.643329,139.799294,江東区東雲第二保育園,認可,82,2022年10月1日時点
江東区,東雲一丁目,-,江東区東雲一丁目８番１８号,35.644821,139.800916,ＹＭＣＡオリーブ保育園,認可,119,2022年10月1日時点
江東区,東雲一丁目,-,江東区東雲一丁目９番１４−１０４号,35.646477,139.804421,ＹＭＣＡキャナルコート保育園,認可,117,2022年10月1日時点
江東区,東雲一丁目,-,江東区東雲一丁目９番１８−２０３号,35.647664,139.804229,ひまわりキッズガーデン東雲,認可,96,2022年10月1日時点
江東区,東雲一丁目,-,江東区東雲一丁目９番５１号,35.649163,139.804535,東雲キャナルコートナーサリースクール,認可,90,2022年10月1日時点
江東区,東雲二丁目,-,江東区東雲二丁目３番１７号３階,35.642184,139.800721,ナーサリールームベリーベアー東雲,認可,119,2022年10月1日時点
江東区,有明一丁目,-,江東区有明１−２−１２,35.641812,139.794567,みらいく有明園,認可,94,2022年10月1日時点
江東区,有明一丁目,-,江東区有明１−３−１,35.638781,139.790132,キッズスマイル江東有明,認可,58,2022年10月1日時点
江東区,有明一丁目,-,江東区有明１−５−２　２階,35.636114,139.782622,さんいく保育園有明,認可,91,2022年10月1日時点
江東区,有明一丁目,-,江東区有明１−５−２２,35.63736,139.781743,江東湾岸サテライトスマートナーサリースクール,認可,271,2022年10月1日時点
江東区,有明一丁目,-,江東区有明１−６−３０,35.6342827,139.7830211,おはよう保育園有明,認可,64,2022年10月1日時点
江東区,有明三丁目,-,江東区有明３−６−１１　３階,35.630895,139.790628,ニチイキッズありあけ保育園,認可,71,2022年10月1日時点
江東区,有明一丁目,-,江東区有明一丁目４番１１号,35.637139,139.787248,ひまわりキッズガーデン有明,認可,122,2022年10月1日時点
江東区,有明一丁目,-,江東区有明一丁目４番２０号,35.63666,139.786425,ひまわりキッズガーデン有明の森,認可,117,2022年10月1日時点
江東区,有明三丁目,-,江東区有明三丁目７番２６号,35.6314667,139.7917905,江東湾岸サテライトナーサリースクール（本園）,認可,352,2022年10月1日時点
江東区,亀戸一丁目,-,江東区亀戸１−２４−６,35.694531,139.824046,江東区亀戸第三保育園,認可,135,2022年10月1日時点
江東区,亀戸一丁目,-,江東区亀戸１−４３−８　１階,35.696675,139.820766,おはよう保育園　亀戸,認可,45,2022年10月1日時点
江東区,亀戸二丁目,-,江東区亀戸２−１０−１０,35.700341,139.8231,クオリスキッズ亀戸保育園,認可,80,2022年10月1日時点
江東区,亀戸三丁目,-,江東区亀戸３ー４３ー２３,35.703735,139.822001,にじいろ保育園亀戸,認可,79,2022年10月1日時点
江東区,亀戸五丁目,-,江東区亀戸５−１−１５,35.697896,139.832286,グローバルキッズ亀戸園,認可,121,2022年10月1日時点
江東区,亀戸六丁目,-,江東区亀戸6-31-1,35.6953953,139.8286887,ポピンズナーサリースクール亀戸,認可,70,2022年10月1日時点
江東区,亀戸六丁目,-,江東区亀戸６−４２ー１３,35.696339,139.831974,こころこうとう保育園,認可,92,2022年10月1日時点
江東区,亀戸六丁目,-,江東区亀戸６−５４−２−１０１,35.696525,139.832462,江東区亀戸保育園,認可,72,2022年10月1日時点
江東区,亀戸七丁目,-,江東区亀戸７−１０−１　１階,35.697658,139.834213,まなびの森保育園亀戸,認可,80,2022年10月1日時点
江東区,亀戸七丁目,-,江東区亀戸７−３８−１２　１・２階,35.697506,139.839351,保育園ミルキーウェイ亀戸園,認可,52,2022年10月1日時点
江東区,亀戸七丁目,-,江東区亀戸７−３９−２８,35.696654,139.839444,江東亀戸サテライトグローバルキッズ竪川園,認可,198,2022年10月1日時点
江東区,亀戸七丁目,-,江東区亀戸７−４１−１６　江東区青少年交流プラザ３・４階,35.696776,139.837388,江東区亀戸第二保育園,認可,103,2022年10月1日時点
江東区,亀戸九丁目,-,江東区亀戸九丁目３４番１−１４０号,35.700283,139.840446,亀戸こころ保育園,認可,136,2022年10月1日時点
江東区,亀戸九丁目,-,江東区亀戸九丁目３６番１０号,35.698439,139.838956,亀戸浅間保育園,認可,80,2022年10月1日時点
江東区,亀戸四丁目,-,江東区亀戸四丁目１３番１８号,35.700941,139.82818,アンジェリカ亀戸保育園,認可,78,2022年10月1日時点
江東区,亀戸四丁目,-,江東区亀戸四丁目２１番１３号,35.702639,139.826584,江東区亀戸第四保育園,認可,131,2022年10月1日時点
江東区,亀戸二丁目,-,江東区亀戸二丁目６番２−１０２号,35.70017,139.822557,陽だまり保育園,認可,80,2022年10月1日時点
江東区,亀戸六丁目,-,江東区亀戸六丁目５３番１１号,35.695916,139.83265,コビープリスクールかめいど,認可,46,2022年10月1日時点
江東区,大島一丁目,-,江東区大島１−１０−５,35.688712,139.823399,グローバルキッズ西大島園,認可,73,2022年10月1日時点
江東区,大島三丁目,-,江東区大島３−１４−５　１階,35.689826,139.828118,プチ・ナーサリー西大島,認可,60,2022年10月1日時点
江東区,大島三丁目,-,江東区大島３−１５−１０,35.690609,139.828836,大島なかよし保育園,認可,45,2022年10月1日時点
江東区,大島四丁目,-,江東区大島４−１−６−１３０,35.687428,139.830089,江東区大島第二保育園,認可,92,2022年10月1日時点
江東区,大島四丁目,-,江東区大島４−２１−３−１０１,35.686485,139.831799,江東区大島第五保育園,認可,105,2022年10月1日時点
江東区,大島五丁目,-,江東区大島５−２７−１３,35.686747,139.835882,太陽の子　大島五丁目保育園,認可,78,2022年10月1日時点
江東区,大島五丁目,-,江東区大島５−３０−１２,35.687737,139.835003,京進のほいくえん　ビーフェアおおじまタウン,認可,60,2022年10月1日時点
江東区,大島五丁目,-,江東区大島５−４０−４　１階,35.687026,139.837178,江東区大島保育園,認可,98,2022年10月1日時点
江東区,大島六丁目,-,江東区大島６−１−６−１３０,35.692341,139.833261,江東区大島第三保育園,認可,101,2022年10月1日時点
江東区,大島六丁目,-,江東区大島６−２２−８,35.692938,139.837237,ココロラボインターナショナル大島,認可,56,2022年10月1日時点
江東区,大島六丁目,-,江東区大島６−２６−１１,35.691102,139.837016,キッズスマイル江東大島,認可,60,2022年10月1日時点
江東区,大島七丁目,-,江東区大島７−３７−１３,35.691958,139.841564,かがやき保育園,認可,161,2022年10月1日時点
江東区,大島八丁目,-,江東区大島８−１２−２０−１０１,35.687331,139.839009,江東区大島第四保育園,認可,99,2022年10月1日時点
江東区,大島八丁目,-,江東区大島８−３１−２,35.68899,139.84211,アスク東大島保育園,認可,70,2022年10月1日時点
江東区,大島九丁目,-,江東区大島９−７−８−１０１,35.694046,139.844188,江東区わかば保育園,認可,112,2022年10月1日時点
江東区,大島三丁目,-,江東区大島三丁目８番７号,35.692453,139.828276,花と鳥保育園,認可,90,2022年10月1日時点
江東区,大島二丁目,-,江東区大島二丁目３６番１５号,35.691557,139.825282,マミー保育園西大島,認可,60,2022年10月1日時点
江東区,北砂五丁目,-,江東区北砂１−１−４−１０１,35.682403,139.831695,江東区北砂保育園,認可,100,2022年10月1日時点
江東区,北砂一丁目,-,江東区北砂１−３−３０,35.684136,139.823684,江東区小名木川保育園,認可,140,2022年10月1日時点
江東区,北砂五丁目,-,江東区北砂１−９−６,35.682403,139.831695,スクルドエンジェル北砂園,認可,73,2022年10月1日時点
江東区,北砂五丁目,-,江東区北砂５−１−２３,35.68022,139.832834,キッズスマイル江東北砂,認可,85,2022年10月1日時点
江東区,北砂五丁目,-,江東区北砂５−１−２８,35.679963,139.832414,Milky Way International Nursery School 北砂校,認可,69,2022年10月1日時点
江東区,北砂五丁目,-,江東区北砂５−１７−５,35.682068,139.834313,にじいろ保育園北砂,認可,69,2022年10月1日時点
江東区,北砂五丁目,-,江東区北砂５−２０−１０−１０１,35.685559,139.833809,江東区亀高第二保育園,認可,110,2022年10月1日時点
江東区,北砂五丁目,-,江東区北砂５−２０−３−１０１,35.682307,139.832035,江東区小名木川第二保育園,認可,122,2022年10月1日時点
江東区,北砂五丁目,-,江東区北砂５−２０−９−１０１,35.684801,139.833006,江東区亀高保育園,認可,111,2022年10月1日時点
江東区,北砂五丁目,-,江東区北砂６−２７−１９,35.682403,139.831695,みらいく北砂園,認可,63,2022年10月1日時点
江東区,北砂五丁目,-,江東区北砂五丁目１４番１０号,35.680734,139.834512,砂町友愛園,認可,100,2022年10月1日時点
江東区,北砂五丁目,-,江東区北砂四丁目１８番２７号,35.682403,139.831695,砂町保育園,認可,100,2022年10月1日時点
江東区,東砂五丁目,-,江東区東砂１−５−３−１０１,35.677307,139.84193,江東区東砂第三保育園,認可,103,2022年10月1日時点
江東区,東砂五丁目,-,江東区東砂２−１３−２−１０１,35.677307,139.84193,江東区東砂保育園,認可,80,2022年10月1日時点
江東区,東砂二丁目,-,江東区東砂２−６−４−１０１,35.684457,139.842979,江東区東砂第二保育園,認可,84,2022年10月1日時点
江東区,東砂五丁目,-,江東区東砂３−２８−１,35.677307,139.84193,マミー保育園東砂,認可,150,2022年10月1日時点
江東区,東砂三丁目,-,江東区東砂３−３０−１１,35.680994,139.844492,みらいく東砂園,認可,60,2022年10月1日時点
江東区,東砂七丁目,-,江東区東砂7-10-3,35.6717876,139.8390462,メリーポピンズ南砂ルーム,認可,64,2022年10月1日時点
江東区,東砂五丁目,-,江東区東砂７−１７−３５−１０１,35.677307,139.84193,江東区東砂第四保育園,認可,92,2022年10月1日時点
江東区,東砂七丁目,-,江東区東砂７−１８−１８,35.67528,139.837739,にじいろ保育園東砂,認可,100,2022年10月1日時点
江東区,東砂八丁目,-,江東区東砂８−１９−４,35.667701,139.84161,キッズスマイル江東東砂,認可,58,2022年10月1日時点
江東区,東砂六丁目,-,江東区東砂六丁目２番１６号,35.669828,139.841543,ともしび保育園,認可,110,2022年10月1日時点
江東区,新砂三丁目,-,江東区新砂三丁目３番１１号,35.659429,139.831695,江東区新砂保育園,認可,119,2022年10月1日時点
江東区,南砂二丁目,-,江東区南砂２−２−１１,35.669609,139.823522,南砂あら川保育園,認可,63,2022年10月1日時点
江東区,南砂二丁目,-,江東区南砂２−２８−２７,35.675431,139.821666,ドリームキッズランド保育園,認可,55,2022年10月1日時点
江東区,南砂二丁目,-,江東区南砂２−３−３−１０２,35.67317,139.823004,江東区南砂第三保育園,認可,104,2022年10月1日時点
江東区,南砂二丁目,-,江東区南砂２−３−４−１０１,35.671798,139.823245,江東区南砂第四保育園,認可,111,2022年10月1日時点
江東区,南砂二丁目,-,江東区南砂２−３６−１０　光陽ビル1F,35.67232,139.825845,太陽の子　南砂２丁目保育園,認可,90,2022年10月1日時点
江東区,南砂二丁目,-,江東区南砂２−３−６−１０３,35.670193,139.823849,江東区南砂第五保育園,認可,70,2022年10月1日時点
江東区,南砂三丁目,-,江東区南砂３−１４−６,35.670138,139.832883,グローバルキッズ南砂園,認可,99,2022年10月1日時点
江東区,南砂四丁目,-,江東区南砂４−１８−４　１・２階,35.672965,139.832479,ルーチェ保育園　南砂,認可,60,2022年10月1日時点
江東区,南砂三丁目,-,江東区南砂４−４−１−１０２,35.672828,139.827857,江東区南砂第一保育園,認可,97,2022年10月1日時点
江東区,南砂六丁目,-,江東区南砂６−１０−１１,35.670636,139.835577,おはよう保育園　南砂町,認可,80,2022年10月1日時点
江東区,南砂七丁目,-,江東区南砂７−９−１１,35.669867,139.835156,江東区城東保育園,認可,119,2022年10月1日時点
江東区,南砂三丁目,-,江東区南砂三丁目１０番８号,35.67006,139.830469,南砂町保育園,認可,90,2022年10月1日時点
江東区,南砂七丁目,-,江東区南砂七丁目１４番１７号,35.668907,139.837783,八幡保育園,認可,65,2022年10月1日時点
江東区,南砂二丁目,-,江東区南砂二丁目３番１−１０１号,35.670288,139.822001,江東区南砂第二保育園,認可,109,2022年10月1日時点
江東区,南砂六丁目,-,江東区南砂六丁目８番３号,35.671211,139.834853,江東区南砂さくら保育園,認可,100,2022年10月1日時点
品川区,北品川三丁目,-,品川区北品川１−１６−４,35.620918,139.738379,ひがしやつやま保育園,認可,54,2022年10月1日時点
品川区,北品川二丁目,-,品川区北品川２−７−２１,35.618862,139.743947,北品川保育園,認可,78,2022年10月1日時点
品川区,東品川二丁目,-,品川区東品川１−２−１５,35.619148,139.751153,八ツ山保育園,認可,63,2022年10月1日時点
品川区,東品川二丁目,-,品川区東品川１−３４−９,35.619148,139.751153,東品川保育園,認可,107,2022年10月1日時点
品川区,東品川二丁目,-,品川区東品川１−８−３０,35.619148,139.751153,台場保育園,認可,116,2022年10月1日時点
品川区,八潮五丁目,-,品川区八潮５−１−３,35.604708,139.752998,八潮北保育園,認可,102,2022年10月1日時点
品川区,八潮五丁目,-,品川区八潮５−４−１６,35.601516,139.750986,八潮西保育園,認可,100,2022年10月1日時点
品川区,八潮五丁目,-,品川区八潮５−６−３２,35.596297,139.749755,八潮南保育園,認可,97,2022年10月1日時点
品川区,大井三丁目,-,品川区東大井１−２２−１６,35.603589,139.731959,東大井保育園,認可,100,2022年10月1日時点
品川区,大井五丁目,-,品川区東大井５−８−１２,35.599505,139.730356,品川保育園,認可,145,2022年10月1日時点
品川区,大井六丁目,-,品川区東大井６−１４−１６,35.596148,139.732412,大井保育園,認可,131,2022年10月1日時点
品川区,大井一丁目,-,品川区南大井１−１６−６,35.607461,139.730236,にじいろ保育園南大井,認可,72,2022年10月1日時点
品川区,南大井一丁目,-,品川区南大井１−８−２３,35.596351,139.739481,グローバルキッズ立会川園,認可,60,2022年10月1日時点
品川区,大井三丁目,-,品川区南大井３−７−４,35.602867,139.730236,南大井保育園,認可,100,2022年10月1日時点
品川区,大井六丁目,-,品川区南大井６−２−１５,35.597822,139.73287,水神保育園,認可,107,2022年10月1日時点
品川区,南大井六丁目,-,品川区南大井６−２６−２　Ｂ館１Ｆ,35.588164,139.731514,キッズガーデン南大井,認可,90,2022年10月1日時点
品川区,大井一丁目,-,品川区大井１−１６−２,35.607787,139.73046,あいのもり保育園,認可,60,2022年10月1日時点
品川区,大井三丁目,-,品川区大井３−１７−１１,35.601706,139.731055,クオリスキッズ大井町保育園,認可,60,2022年10月1日時点
品川区,大井三丁目,-,品川区大井３−２６−７,35.600728,139.730496,クオリスキッズ大井町第２保育園,認可,60,2022年10月1日時点
品川区,大井四丁目,-,品川区大井４−１１−８,35.602174,139.734218,大井倉田保育園,認可,110,2022年10月1日時点
品川区,大井四丁目,-,品川区大井４−１１−８,35.602174,139.734218,大井倉田保育園,認可,110,2022年10月1日時点
品川区,大井五丁目,-,品川区大井５−１８−１,35.598079,139.727728,滝王子保育園,認可,80,2022年10月1日時点
品川区,大井五丁目,-,品川区大井５−１８−１,35.598079,139.727728,滝王子保育園,認可,80,2022年10月1日時点
品川区,大井七丁目,-,品川区大井７−４−１８,35.596483,139.729219,緑の家保育園,認可,70,2022年10月1日時点
品川区,大井一丁目,-,品川区大井一丁目３１番１号　シティタワー大井町１階,35.6055,139.730833,しなおおコスモ保育園,認可,69,2022年10月1日時点
品川区,西大井四丁目,-,品川区西大井１−１−１,35.59767,139.720499,西大井保育園,認可,116,2022年10月1日時点
品川区,西大井四丁目,-,品川区西大井１−１−１,35.59767,139.720499,西大井保育園,認可,116,2022年10月1日時点
品川区,西大井四丁目,-,品川区西大井１−４−１,35.59767,139.720499,まなびの森保育園西大井,認可,100,2022年10月1日時点
品川区,西大井二丁目,-,品川区西大井２−５−２１,35.599172,139.722256,キッズタウンにしおおい,認可,100,2022年10月1日時点
品川区,西大井四丁目,-,品川区西大井４−１９−１１,35.593908,139.719206,みどりの丘保育園,認可,68,2022年10月1日時点
品川区,西大井四丁目,-,品川区西大井６−１−１５,35.59767,139.720499,冨士見台保育園,認可,120,2022年10月1日時点
品川区,西大井四丁目,-,品川区西大井６−１−１５,35.59767,139.720499,冨士見台保育園,認可,120,2022年10月1日時点
品川区,西大井四丁目,-,品川区西大井６−１３−１,35.59767,139.720499,伊藤保育園,認可,100,2022年10月1日時点
品川区,西大井四丁目,-,品川区西大井６−１３−１,35.59767,139.720499,伊藤保育園,認可,100,2022年10月1日時点
品川区,西大井四丁目,-,品川区西大井６−６−２,35.59767,139.720499,グローバルキッズ西大井園,認可,86,2022年10月1日時点
品川区,西大井四丁目,-,品川区西大井６−７−１,35.59767,139.720499,西大井えほん保育園,認可,80,2022年10月1日時点
品川区,北品川三丁目,-,品川区北品川５−３−１,35.620918,139.738379,五反田第二保育園,認可,50,2022年10月1日時点
品川区,北品川三丁目,-,品川区北品川５−９−１５,35.620918,139.738379,グローバルキッズ大崎園,認可,60,2022年10月1日時点
品川区,北品川三丁目,-,品川区北品川６−７−２２,35.620918,139.738379,キッズガーデン北品川,認可,90,2022年10月1日時点
品川区,北品川三丁目,-,品川区北品川五丁目３番１号,35.620918,139.738379,品川区立五反田第二保育園,認可,50,2022年10月1日時点
品川区,上大崎三丁目,-,品川区上大崎３−１−１　目黒セントラルスクエア３階,35.63341,139.716748,花房山目黒駅前保育園３３３,認可,120,2022年10月1日時点
品川区,大崎三丁目,-,品川区上大崎３−１４−３５,35.617715,139.723771,ＴＫチルドレンズファーム上大崎校,認可,60,2022年10月1日時点
品川区,上大崎四丁目,-,品川区上大崎４−５−３７　本多電機ビル１・２階,35.628599,139.715569,キッズガーデン品川上大崎,認可,108,2022年10月1日時点
品川区,東五反田一丁目,-,品川区東五反田１−２−２５,35.627836,139.727223,ほっぺるランド東五反田,認可,60,2022年10月1日時点
品川区,東五反田一丁目,-,品川区東五反田４−７−２０,35.627278,139.725607,大空と大地のなーさりぃ東五反田園,認可,108,2022年10月1日時点
品川区,東五反田五丁目,-,品川区東五反田５−２４−１,35.62798,139.723378,東五反田保育園,認可,78,2022年10月1日時点
品川区,東五反田五丁目,-,品川区東五反田５−２４−１,35.62798,139.723378,東五反田保育園,認可,78,2022年10月1日時点
品川区,西五反田一丁目,-,品川区西五反田１−２１−８,35.622972,139.723263,まなびの森保育園大崎広小路,認可,60,2022年10月1日時点
品川区,西五反田三丁目,-,品川区西五反田３−１２−１２　２Ｆ,35.62728,139.714755,不動前えほん保育園,認可,73,2022年10月1日時点
品川区,西五反田三丁目,-,品川区西五反田３−８−８,35.626434,139.717975,ウィズブック保育園西五反田,認可,101,2022年10月1日時点
品川区,西五反田七丁目,-,品川区西五反田３−９−１０,35.623568,139.719222,西五反田保育園,認可,79,2022年10月1日時点
品川区,西五反田七丁目,-,品川区西五反田３−９−１０,35.623568,139.719222,西五反田保育園,認可,79,2022年10月1日時点
品川区,西五反田七丁目,-,品川区西五反田３−９−９,35.623568,139.719222,ぷりすくーる西五反田,認可,46,2022年10月1日時点
品川区,西五反田七丁目,-,品川区西五反田３−９−９,35.623568,139.719222,ぷりすくーる西五反田,認可,46,2022年10月1日時点
品川区,西五反田四丁目,-,品川区西五反田４−１１−１８,35.62571,139.70829,宝保育園,認可,88,2022年10月1日時点
品川区,西五反田七丁目,-,品川区西五反田５−６−３８,35.623568,139.719222,こころしながわふどうまえ保育園,認可,97,2022年10月1日時点
品川区,西五反田七丁目,-,品川区西五反田６−５−６,35.623568,139.719222,西五反田第二保育園,認可,130,2022年10月1日時点
品川区,西五反田七丁目,-,品川区西五反田６−５−６,35.623568,139.719222,西五反田第二保育園,認可,130,2022年10月1日時点
品川区,西五反田七丁目,-,品川区西五反田７−１９−１　２Ｆ,35.623891,139.718502,太陽の子西五反田保育園,認可,60,2022年10月1日時点
品川区,西五反田八丁目,-,品川区西五反田８−１０−２１,35.619577,139.72032,キッズガーデン品川西五反田,認可,83,2022年10月1日時点
品川区,西五反田一丁目,-,品川区西五反田一丁目２９番２号　吾作ビル,35.624998,139.722115,キッズガーデン五反田駅前,認可,73,2022年10月1日時点
品川区,大崎二丁目,-,品川区大崎2-1-1 ThinkPark Plaza１階,35.6184266,139.7275827,AIAI NURSERY 大崎,認可,60,2022年10月1日時点
品川区,大崎三丁目,-,品川区大崎３−１−９,35.620842,139.724875,大崎ひまわり保育園,認可,70,2022年10月1日時点
品川区,大崎三丁目,-,品川区大崎３−６−３２,35.62044,139.726585,Ｇａｋｋｅｎほいくえん　大崎,認可,90,2022年10月1日時点
品川区,大崎四丁目,-,品川区大崎４−１−２　ウィン第２五反田ビル２Ｆ,35.622509,139.722933,ベネッセ大崎広小路保育園,認可,88,2022年10月1日時点
品川区,大崎五丁目,-,品川区大崎５−２−１,35.621897,139.726427,大崎保育園,認可,125,2022年10月1日時点
品川区,大崎五丁目,-,品川区大崎５−２−１,35.621897,139.726427,大崎保育園,認可,125,2022年10月1日時点
